PB_ID,EX_ID,PB_NUM,PB_QUES,PB_DETAIL,PB_CHOI1,PB_CHOI2,PB_CHOI3,PB_CHOI4,PB_ANS,PB_SOLU,PB_CR,PB_TOPIC
,7,87,블루투스(Bluetooth) 공격과 해당 공격에 대한 설명이 올바르게 연결된 것은?,,블루버그(BlueBug) - 블루투스의 취약점을 활용하여 장비의 파일에 접근하는 공격으로 OPP를 사용하여 정보를 열람,블루스나프(BlueSnarf) - 블루투스를 이용해 스팸처럼 명함을 익명으로 퍼뜨리는 것,블루프린팅(BluePrinting) - 블루투스 공격 장치의 검색 활동을 의미,블루재킹(BlueJacking) - 블루투스 장비사이의 취약한 연결 관리를 악용한 공격,3,,44,
,7,88,DoS(Denial of Service) 공격과 관련한 내용으로 틀린 것은?,,Ping of Death 공격은 정상 크기보다 큰 ICMP 패킷을 작은 조각(Fragment)으로 쪼개어 공격 대상이 조각화 된 패킷을 처리하게 만드는 공격 방법이다.,Smurf 공격은 멀티캐스트(Multicast)를 활용하여 공격 대상이 네트워크의 임의의 시스템에 패킷을 보내게 만드는 공격이다.,SYN Flooding은 존재하지 않는 클라이언트가 서버별로 한정된 접속 가능 공간에 접속한 것처럼 속여 다른 사용자가 서비스를 이용하지 못하게 하는 것이다.,Land 공격은 패킷 전송 시 출발지 IP주소와 목적지 IP주소 값을 똑같이 만들어서 공격 대상에게 보내는 공격 방법이다.,2,,38,
,7,89,다음 설명에 해당하는 시스템은?,https://www.cbtbank.kr/images/iz/iz20220305/iz20220305m89.gif,Apache,Hadoop,Honeypot,MapReduce,3,,64,
,7,90,다음이 설명하는 IT 기술은?,https://www.cbtbank.kr/images/iz/iz20220305/iz20220305m90.gif,StackGuard,Docker,Cipher Container,Scytale,2,,53,
,7,91,간트 차트(Gantt Chart)에 대한 설명으로 틀린 것은?,,프로젝트를 이루는 소작업 별로 언제 시작되고 언제 끝나야 하는지를 한 눈에 볼 수 있도록 도와준다.,자원 배치 계획에 유용하게 사용된다.,CPM 네트워크로부터 만드는 것이 가능하다.,수평 막대의 길이는 각 작업(Task)에 필요한 인원수를 나타낸다.,4,,64,
,7,92,Python 기반의 웹 크롤링(Web Crawling) 프레임워크로 옳은 것은?,,Li-fi,Scrapy,CrawlCat,SBAS,2,,47,
,7,93,Secure 코딩에서 입력 데이터의 보안 약점과 관련한 설명으로 틀린 것은?,,SQL 삽입 : 사용자의 입력 값 등 외부 입력 값이 SQL 쿼리에 삽입되어 공격,크로스사이트 스크립트 : 검증되지 않은 외부 입력 값에 의해 브라우저에서 악의적인 코드가 실행,운영체제 명령어 삽입 : 운영체제 명령어 파라미터 입력 값이 적절한 사전검증을 거치지 않고 사용되어 공격자가 운영체제 명령어를 조작,자원 삽입 : 사용자가 내부 입력 값을 통해 시스템 내에 사용이 불가능한 자원을 지속적으로 입력함으로써 시스템에 과부하 발생,4,,43,
,7,94,Windows 파일 시스템인 FAT와 비교했을 때의 NTFS의 특징이 아닌 것은?,,보안에 취약,대용량 볼륨에 효율적,자동 압축 및 안정성,저용량 볼륨에서의 속도 저하,1,,51,
,7,95,DES는 몇 비트의 암호화 알고리즘인가?,,8,24,64,132,3,,66,
,7,96,리눅스에서 생성된 파일 권한이 644일 경우 umask 값은?,,022,666,777,755,1,,49,
,7,97,다음 내용이 설명하는 로그 파일은?,https://www.cbtbank.kr/images/iz/iz20220305/iz20220305m97.gif,tapping,xtslog,linuxer,wtmp,4,,41,
,7,98,상향식 비용 산정 기법 중 LOC(원시 코드 라인 수) 기법에서 예측치를 구하기 위해 사용하는 항목이 아닌 것은?,,낙관치,기대치,비관치,모형치,4,,62,
,7,99,"OSI 7 Layer 전 계층의 프로토콜과 패킷 내부의 콘텐츠를 파악하여 침입 시도, 해킹 등을 탐지하고 트래픽을 조정하기 위한 패킷 분석 기술은?",,PLCP(Packet Level Control Processor),Traffic Distributor,Packet Tree,DPI(Deep Packet Inspection),4,,46,
,7,100,소프트웨어 개발 방법론의 테일러링(Tailoring)과 관련한 설명으로 틀린 것은?,,프로젝트 수행 시 예상되는 변화를 배제하고 신속히 진행하여야 한다.,"프로젝트에 최적화된 개발 방법론을 적용하기 위해 절차, 산출물 등을 적절히 변경하는 활동이다.",관리 측면에서의 목적 중 하나는 최단기간에 안정적인 프로젝트 진행을 위한 사전 위험을 식별하고 제거하는 것이다.,기술적 측면에서의 목적 중 하나는 프로젝트에 최적화된 기술 요소를 도입하여 프로젝트 특성에 맞는 최적의 기법과 도구를 사용하는 것이다.,1,,55,
